<tui xmlns:xsi="http://www.w3.org/2001/XMLSchema-instance" xsi:noNamespaceSchemaLocation="../tui.xsd" on_visit="sc_tab_theme">
  <script src="showcase_callbacks.sh"/>
  <theme src="theme.css"/>

  <pane id="root" split="v" title="Dinos Amazing Bash TUI" border="single" class="sidebar">
    <include src="_header.xml"/>
  <pane id="root1" weight="90" split="h">
    <pane id="sidebar" weight="22" split="v" border="none">
      <pane id="nav"      weight="58" title="Menu"  border="single" class="sidebar"/>
      <pane id="controls" weight="42" title="Theme" border="single" class="sidebar" hpad="1"/>
    </pane>
    <pane id="main" split="v" border="single" weight="78" class="panel" hpad="1">
      <pane id="tabs_header" weight="5" border="none"/>
      <pane id="output" weight="95" border="heavy" class="panel" scroll="both"/>
    </pane>
  </pane>
  </pane>

  <tabs id="th_tabs" header_pane="tabs_header" content_pane="output" style="compact">
    <tab id="tab_renderers" text="Renderers"    action="sc_goto_renderers"/>
    <tab id="tab_theme"     text="Theme colors" action="sc_tab_here" default="true"/>
    <tab id="tab_fit"       text="Fit to size"  action="sc_goto_fit"/>
    <tab id="tab_live"      text="Live"         action="sc_goto_live"/>
  </tabs>

  <label  id="lbl_th_hd" pane="controls" row="0" text="Switch overlay:" class="muted_label"/>
  <button id="btn_sc_th_default" pane="controls" row="2" text="Default" action="sc_theme_pick" class="nav_link" align="fill"/>
  <button id="btn_sc_th_ocean"   pane="controls" row="3" text="Ocean"   action="sc_theme_pick" class="nav_link" align="fill"/>
  <button id="btn_sc_th_forest"  pane="controls" row="4" text="Forest"  action="sc_theme_pick" class="nav_link" align="fill"/>
  <button id="btn_sc_th_sunset"  pane="controls" row="5" text="Sunset"  action="sc_theme_pick" class="nav_link" align="fill"/>
  <button id="btn_sc_th_light"   pane="controls" row="6" text="Light"   action="sc_theme_pick" class="nav_link" align="fill"/>

  <include src="_nav.xml"/>
</tui>
